"","Code","Location name","Sources","Log","Notes","Date recorded","Active local cases on date override","Recent local fatalities on date override"
"1","FJI","Fiji","http://www.health.gov.fj/statement-from-the-acting-permanent-secretary-for-health-and-medical-services-2/, http://www.health.gov.fj/statement-from-the-health-and-medical-services/, http://www.health.gov.fj/10-07-20-statement-from-the-acting-permanent-secretary-for-health-and-medical-services/, http://www.health.gov.fj/statement-from-the-acting-permanent-secretary-for-mhms/",NA,"All cases reported by Fiji ministry of health since at least 7 July are imported.",2020-09-01,0,0
"2","TWN","Taiwan","https://sites.google.com/cdc.gov.tw/2019-ncov/taiwan",NA,"No locally acquired Taiwanese cases recorded since May 1",2020-08-22,0,0
"3","THA","Thailand","https://ddc.moph.go.th/viralpneumonia/eng/situation.php",NA,"Local transmission has been exactly 2444 cases since May 25",2020-08-22,0,0
"4","CHN","Mainland China","http://www.chinacdc.cn/jkzt/crb/zl/szkb_11803/jszl_11809/ (China CDC)",NA,"From China CDC's current reporting, most cases are local; currently all in Xinjiang and Liaoning. If we could split cases up by China provincial-level units, this would help de-risk most provinces, but we probably have no way to hard-assure people aren't coming from Xinjiang or Liaoning",2020-07-30,684,NA
"5","AU-NSW","New South Wales, Australia","https://www.health.nsw.gov.au/news/Pages/20200802_00.aspx",NA,"plenty of local cases in NSW still, unfortunately",NA,NA,NA
"6","AU-QLD","Queensland","https://web.archive.org/web/*/https://www.qld.gov.au/health/conditions/health-alerts/coronavirus-covid-19/current-status/statistics#casebysource","https://docs.google.com/document/d/1RVjRF5bF26OIAqlUY1b6NIOAEt3HoBqeHflFf-zjrLA/edit#","See the doc for strategy here",2020-08-15,5,NA
"7","KOR","South Korea","http://ncov.mohw.go.kr/en/bdBoardList.do?brdId=16&brdGubun=161&dataGubun=&ncvContSeq=&contSeq=&board_id=, https://coronaboard.kr/en/",NA,"For South Korea, some cases are marked ""Lazaretto"" or ""Quarantine""; these should be ALL imported. So we can subtract tehse from the total figure. This may not be a complete correction because some cases are only discovered after they've arrived (I don't know if these are quarantined or not).",2020-08-02,492,NA
"8","MYS","Malaysia","http://covid-19.moh.gov.my/terkini/072020/situasi-terkini-31-julai-2020/PS%20DG,%20COVID-19%20updates%20(31%20July%202020).pdf",NA,"Seems like currently, roughly 25% of Malaysian cases are imported. Further research could pin this down more.",2020-08-01,NA,NA
